{"schemaVersion":1,"releaseId":"fixture-v0","currentSceneId":"s04","chapterId":"chapter-sho","completedEventIds":["intro-completed"],"reachedSpotIds":[],"solvedPuzzleIds":[],"viewedHintIds":[],"collectedPartIds":[],"listenedAudioIds":[],"audioProgress":{},"q4Order":["R","A","M","I"],"endingSeen":false,"updatedAt":"2026-09-13T00:00:00.000Z"}
